{
  "$schema": "https://json-schema.org/draft/2020-12/schema",
  "$id": "naam-translation-scene-record-schema",
  "title": "Naam source-linked English translation scene record",
  "description": "Scene-sharded English derivative for Naam. Source scene numbers are printed and preserved. Canonical Tamil, immutable dialogue records, character mappings and song/performance records remain authoritative.",
  "type": "object",
  "required": ["work_id","target_language","scene_id","scene_ordinal","source_scene_number","scene_status","unit_count","units"],
  "properties": {
    "work_id": {"const": "naam"},
    "target_language": {"const": "en"},
    "scene_id": {"type":"string","pattern":"^naam-s[0-9]{3}$"},
    "scene_ordinal": {"type":"integer","minimum":1,"maximum":45},
    "source_scene_number": {"type":"integer","minimum":1,"maximum":45},
    "pilot_status": {"enum":["draft","review","verified"]},
    "scene_status": {"enum":["draft","review","verified"]},
    "unit_count": {"type":"integer","minimum":0},
    "units": {"type":"array","items":{"$ref":"#/$defs/unit"}}
  },
  "additionalProperties": false,
  "$defs": {
    "page_provenance": {
      "type":"object",
      "required":["pdf_page","printed_page"],
      "properties": {
        "pdf_page":{"type":"integer","minimum":1},
        "printed_page":{"type":["integer","null"],"minimum":1}
      },
      "additionalProperties":false
    },
    "source_locator": {
      "type":["object","null"],
      "properties": {
        "kind":{"type":"string"},
        "ordinal":{"type":"integer","minimum":1},
        "description":{"type":"string"}
      },
      "required":["kind","ordinal","description"],
      "additionalProperties":false
    },
    "source": {
      "type":"object",
      "required":["source_path","canonical_scene_path","source_record_id","source_occurrence_id","source_locator","speaker_label","speaker_label_origin","source_delimiter","page_provenance"],
      "properties": {
        "source_path":{"type":"string","minLength":1},
        "canonical_scene_path":{"type":"string","minLength":1},
        "source_record_id":{"type":["string","null"]},
        "source_occurrence_id":{"type":["string","null"]},
        "source_locator":{"$ref":"#/$defs/source_locator"},
        "speaker_label":{"type":["string","null"]},
        "speaker_label_origin":{"type":["string","null"],"enum":["source-explicit",null]},
        "source_delimiter":{"type":["string","null"]},
        "page_provenance":{"type":"array","minItems":1,"items":{"$ref":"#/$defs/page_provenance"}}
      },
      "additionalProperties":false
    },
    "line_map": {
      "type":"object",
      "required":["ordinal","kind","pdf_page","tamil","english"],
      "properties": {
        "ordinal":{"type":"integer","minimum":1},
        "kind":{"enum":["role-cue","lyric-line","performance-cue"]},
        "pdf_page":{"type":"integer","minimum":1},
        "tamil":{"type":"string","minLength":1},
        "english":{"type":"string","minLength":1}
      },
      "additionalProperties":false
    },
    "translation": {
      "type":"object",
      "properties": {
        "english_text":{"type":"string","minLength":1},
        "english_lines":{"type":"array","minItems":1,"items":{"type":"string"}},
        "line_map":{"type":"array","minItems":1,"items":{"$ref":"#/$defs/line_map"}},
        "mode":{"enum":["prose-faithful","semantic-poetic-source-faithful"]},
        "notes":{"type":"array","items":{"type":"string"}}
      },
      "oneOf":[
        {"required":["english_text","mode","notes"]},
        {"required":["english_lines","mode","notes"]}
      ],
      "additionalProperties":false
    },
    "unit": {
      "type":"object",
      "required":["id","kind","status","target_language","scene_id","scene_ordinal","source_scene_number","source","translation"],
      "properties": {
        "id":{"type":"string","pattern":"^naam-en-s[0-9]{3}-u[0-9]{3}$"},
        "kind":{"enum":["narrative","dialogue","stage-direction","performance-cue","song","written-text"]},
        "status":{"enum":["draft","review","verified"]},
        "target_language":{"const":"en"},
        "scene_id":{"type":"string","pattern":"^naam-s[0-9]{3}$"},
        "scene_ordinal":{"type":"integer","minimum":1,"maximum":45},
        "source_scene_number":{"type":"integer","minimum":1,"maximum":45},
        "source":{"$ref":"#/$defs/source"},
        "translation":{"$ref":"#/$defs/translation"}
      },
      "additionalProperties":false
    }
  }
}
